<?xml version="1.0" encoding="UTF-8"?>
<xs:schema xmlns:xs="http://www.w3.org/2001/XMLSchema">

  <xs:element name="Danh_Sach_Dich_Vu">
    <xs:complexType>
      <xs:sequence>
        <xs:element name="DichVu" maxOccurs="unbounded">
          <xs:complexType>
            <xs:sequence>
              <xs:element name="LoaiDichVu" maxOccurs="unbounded">
                <xs:complexType>
                  <xs:attribute name="MSLoaiDV" type="xs:string" use="required"/>
                  <xs:attribute name="TenLoaiDV" type="xs:string" use="required"/>
                  <xs:attribute name="DonGia" type="xs:decimal" use="required"/>
                </xs:complexType>
              </xs:element>
            </xs:sequence>
            <xs:attribute name="MSDV" type="xs:string" use="required"/>
            <xs:attribute name="TenDV" type="xs:string" use="required"/>
          </xs:complexType>
        </xs:element>
      </xs:sequence>
    </xs:complexType>
  </xs:element>

</xs:schema>
